C2: 20,000*4 | E2: 200,000*4 | G2: 2,000,000*4 | I2: 20,000,000*4
C3: write | D3: read | E3: write | F3: read | G3: write | H3: read | I3: write | J3: read
A4: No checksum
C5: 2.0479999999999999E-3 | D5: 3.0330000000000001E-3 | E5: 2.0764999999999999E-2 | F5: 3.6881999999999998E-2 | G5: 0.278308 | H5: 0.31210399999999999 | I5: 3.1045790000000002 | J5: 2.2887227999999999
C6: 2.081E-3 | D6: 2.928E-3 | E6: 2.1051E-2 | F6: 3.7311999999999998E-2 | G6: 0.27703899999999998 | H6: 0.30848199999999998 | I6: 3.2045300000000001 | J6: 2.2984536000000002
C7: 2.0470000000000002E-3 | D7: 2.8779999999999999E-3 | E7: 1.9692999999999999E-2 | F7: 3.7247000000000002E-2 | G7: 0.27854000000000001 | H7: 0.308253 | I7: 3.2916319999999999 | J7: 2.2848290000000002
C8: 2.0730000000000002E-3 | D8: 2.8809999999999999E-3 | E8: 1.9792000000000001E-2 | F8: 3.7253000000000001E-2 | G8: 0.28089700000000001 | H8: 0.31121799999999999 | I8: 3.1588090000000002 | J8: 2.2984536000000002
B9: Average | C9: =AVERAGE(C5:C8) -> 2.0622499999999998E-3 | D9: =AVERAGE(D5:D8) -> 2.9299999999999999E-3 | E9: =AVERAGE(E5:E8) -> 2.032525E-2 | F9: =AVERAGE(F5:F8) -> 3.7173499999999998E-2 | G9: =AVERAGE(G5:G8) -> 0.278696 | H9: =AVERAGE(H5:H8) -> 0.31001424999999999 | I9: =AVERAGE(I5:I8) -> 3.1898874999999998 | J9: =AVERAGE(J5:J8) -> 2.2926147500000003
A10: Fletcher32
C11: 2.6120000000000002E-3 | D11: 4.6709999999999998E-3 | E11: 2.776E-2 | F11: 5.7361000000000002E-2 | G11: 0.40687000000000001 | H11: 0.448791 | I11: 5.2675400000000003 | J11: 4.2304519999999997
C12: 2.5709999999999999E-3 | D12: 4.6730000000000001E-3 | E12: 2.7969000000000001E-2 | F12: 6.5268000000000007E-2 | G12: 0.48052800000000001 | H12: 0.45122400000000001 | I12: 5.5754919999999997 | J12: 4.2696019999999999
C13: 2.6940000000000002E-3 | D13: 4.5960000000000003E-3 | E13: 2.7855000000000001E-2 | F13: 7.4428999999999995E-2 | G13: 0.43911499999999998 | H13: 0.447718 | I13: 5.5354929999999998 | J13: 4.2312120000000002
C14: 2.6220000000000002E-3 | D14: 4.6709999999999998E-3 | E14: 2.777E-2 | F14: 5.7578999999999998E-2 | G14: 0.40998899999999999 | H14: 0.44634400000000002 | I14: 5.5547029999999999 | J14: 4.2779990000000003
B15: Average | C15: =AVERAGE(C11:C14) -> 2.6247500000000003E-3 | D15: =AVERAGE(D11:D14) -> 4.6527500000000006E-3 | E15: =AVERAGE(E11:E14) -> 2.7838500000000002E-2 | F15: =AVERAGE(F11:F14) -> 6.3659250000000001E-2 | G15: =AVERAGE(G11:G14) -> 0.4341255 | H15: =AVERAGE(H11:H14) -> 0.44851925000000004 | I15: =AVERAGE(I11:I14) -> 5.4833069999999999 | J15: =AVERAGE(J11:J14) -> 4.2523162499999998
A16: Adler32
C17: 4.7200000000000002E-3 | D17: 1.0447E-2 | E17: 5.3654E-2 | F17: 0.12925300000000001 | G17: 0.84875800000000001 | H17: 0.98283900000000002 | I17: 12.194781000000001 | J17: 8.8852100000000007
C18: 4.607E-3 | D18: 1.0633999999999999E-2 | E18: 5.0847000000000003E-2 | F18: 0.13961799999999999 | G18: 0.80865900000000002 | H18: 0.97703899999999999 | I18: 12.34249 | J18: 8.8936589999999995
C19: 4.6709999999999998E-3 | D19: 1.0566000000000001E-2 | E19: 5.0708000000000003E-2 | F19: 0.12540100000000001 | G19: 0.85118499999999997 | H19: 0.95899000000000001 | I19: 13.225334999999999 | J19: 8.8979649999999992
C20: 4.8520000000000004E-3 | D20: 1.0671E-2 | E20: 6.6479999999999997E-2 | F20: 0.126106 | G20: 0.827399 | H20: 0.95738299999999998 | I20: 13.139082 | J20: 8.8864409999999996
B21: Average | C21: =AVERAGE(C17:C20) -> 4.7124999999999997E-3 | D21: =AVERAGE(D17:D20) -> 1.05795E-2 | E21: =AVERAGE(E17:E20) -> 5.5422250000000006E-2 | F21: =AVERAGE(F17:F20) -> 0.1300945 | G21: =AVERAGE(G17:G20) -> 0.83400025000000011 | H21: =AVERAGE(H17:H20) -> 0.96906274999999997 | I21: =AVERAGE(I17:I20) -> 12.725422 | J21: =AVERAGE(J17:J20) -> 8.8908187499999993